{
  "$schema": "./schemas/contribution-handover.schema.json",
  "schemaVersion": 1,
  "pr": {
    "title": "fix(ElementAction): verifyState uses resolve() to go through EnhancedResolver",
    "branch": "fix/verify-state-bypasses-enhanced-resolver",
    "summary": "verifyState was calling this.repo.getSelector() instead of this.resolve(), causing role+name selectors to be serialised as [role='textbox'] CSS attribute selectors that only match elements with explicit role= HTML attributes. This silently broke verifyState on React/Vue/Angular apps with implicit ARIA roles. The fix routes verifyState through the same resolve() path used by every other method in ElementAction."
  },
  "preflight": {
    "branchSyncedWithMain": true,
    "duplicateIssuesSearched": true,
    "duplicatePRsSearched": true,
    "depVersionsChecked": true
  },
  "design": {
    "argumentOrderConvention": true,
    "asyncEverywhere": true,
    "stepsKeptLightweight": true,
    "namingConvention": true,
    "noRawLocatorInSrc": true,
    "presenceDetectInActions": true,
    "webOnlyCastAtSite": true,
    "errorMessageFormatFollowed": true,
    "loggingPresent": true,
    "typescriptDiscipline": true
  },
  "tests": {
    "implemented": true,
    "exerciseRealVueApp": true,
    "nonTautologicalAssertions": true,
    "passing": true,
    "specFiles": ["tests/enhanced-selectors.spec.ts"]
  },
  "build": {
    "buildPasses": true,
    "fullSuitePassing": true,
    "knownFailures": "Full suite run against GitHub Pages app (civitas-cerebrum.github.io/vue-test-app) due to arm64/amd64 mismatch with local Docker image. All 37 enhanced-selectors tests and all element-states tests passed."
  },
  "coverage": {
    "apiCoverageGate100": true
  },
  "docs": {
    "readmeUpdated": false,
    "readmeUpdatedReason": "Bugfix only — verifyState already exists in the README. No new public API surface added. Rule 19 applies only to new public methods.",
    "apiReferenceUpdated": false,
    "apiReferenceUpdatedReason": "Bugfix only — verifyState is already documented in api-reference.md with the same signature and contract. Rule 19 applies only to new public methods.",
    "skillFilesUpdated": false,
    "skillFilesUpdatedReason": "No workflow stage or contribution rule changed. Skill file updates are only required when workflow stages or hard rules are affected."
  },
  "version": {
    "patchBumpedOnce": false,
    "patchBumpedOnceReason": "Per maintainer instruction, no version bump in this PR.",
    "from": "0.3.6",
    "to": "0.3.6"
  }
}
